{
  "$schema": "../../../schemas/public-project.schema.json",
  "schemaVersion": 1,
  "recordType": "project",
  "id": "career-ledger",
  "slug": "career-ledger",
  "name": "Career Ledger",
  "kind": "tool",
  "status": "active",
  "summary": "A private-first engineering career ledger with a sanitized static public portfolio.",
  "description": "Career Ledger reads local project evidence through an offline workflow, uses agent-guided analysis to maintain private initiatives, and publishes only manually approved records. The public site and JSON feed are generated statically for GitHub Pages.",
  "areas": [
    "Developer Experience",
    "AI Engineering",
    "Product Engineering",
    "System Design"
  ],
  "technologies": [
    "Node.js",
    "Git",
    "GitHub Actions",
    "GitHub Pages",
    "Codex",
    "JSON"
  ],
  "relatedEntries": [
    "career-ledger-foundation"
  ],
  "featured": true,
  "publication": {
    "status": "approved",
    "sanitized": true,
    "reviewedAt": "2026-08-26",
    "approvedBy": "owner"
  },
  "links": [],
  "localizations": {
    "pt-BR": {
      "name": "Career Ledger",
      "summary": "Um registro profissional de engenharia com análise privada e um portfólio público estático e revisado.",
      "description": "O Career Ledger analisa evidências de projetos locais por meio de um fluxo offline, usa análise orientada por agentes para manter iniciativas privadas e publica apenas registros aprovados manualmente. O site público e o feed JSON são gerados estaticamente para o GitHub Pages.",
      "links": []
    }
  }
}
